{
  "schema_version": "1.0",
  "tool": {
    "name": "google-play-review-guardian",
    "version": "0.1.0"
  },
  "generated_at": "2026-10-17T01:12:15+00:00",
  "mode": "gate",
  "target": {
    "project": "/private/tmp/gprg-example/demo_app",
    "aab": "/private/tmp/gprg-example/demo_app/build/app/outputs/bundle/release/app-release.aab",
    "apk": "/private/tmp/gprg-example/demo_app/build/app/outputs/flutter-apk/app-release.apk",
    "aab_sha256": null,
    "apk_sha256": null,
    "project_type": "flutter",
    "form_factor": "phone/tablet",
    "submission": null
  },
  "app": {
    "package": "com.example.app",
    "label": "Example App",
    "version_name": "2.1.0",
    "version_code": 45,
    "min_sdk": 24,
    "target_sdk": 36,
    "compile_sdk": 36,
    "source": "artefato app-release.aab (manifest mesclado)"
  },
  "final_status": "BLOCKED",
  "exit_code": 2,
  "status_disclaimer": "READY significa apenas ausência de bloqueios nas verificações executadas; não garante aprovação pelo Google Play.",
  "sections": {
    "android_build": {
      "label": "ANDROID BUILD",
      "status": "NEEDS_REVIEW",
      "counts": {
        "INFO": 1,
        "PASS": 15,
        "NOT_VERIFIED": 1
      }
    },
    "target_sdk": {
      "label": "TARGET SDK",
      "status": "PASS",
      "counts": {
        "PASS": 1
      }
    },
    "page_size_16kb": {
      "label": "16 KB PAGE COMPATIBILITY",
      "status": "NEEDS_REVIEW",
      "counts": {
        "INFO": 2,
        "PASS": 3,
        "NOT_VERIFIED": 1
      }
    },
    "signing": {
      "label": "SIGNING",
      "status": "NEEDS_REVIEW",
      "counts": {
        "PASS": 3,
        "NOT_VERIFIED": 3
      }
    },
    "security": {
      "label": "SECURITY",
      "status": "NEEDS_REVIEW",
      "counts": {
        "INFO": 2,
        "PASS": 2,
        "NOT_VERIFIED": 2
      }
    },
    "permissions": {
      "label": "PERMISSIONS",
      "status": "BLOCKED",
      "counts": {
        "BLOCKER": 1,
        "WARNING": 2,
        "NOT_VERIFIED": 1
      }
    },
    "data_safety": {
      "label": "DATA SAFETY",
      "status": "WARNING",
      "counts": {
        "WARNING": 2,
        "INFO": 1,
        "NOT_VERIFIED": 3
      }
    },
    "billing": {
      "label": "GOOGLE PLAY BILLING",
      "status": "BLOCKED",
      "counts": {
        "BLOCKER": 1,
        "INFO": 1,
        "NOT_VERIFIED": 1
      }
    },
    "play_console": {
      "label": "PLAY CONSOLE METADATA",
      "status": "NOT_VERIFIED",
      "counts": {
        "NOT_VERIFIED": 9
      }
    },
    "testing": {
      "label": "TESTING / PRODUCTION ACCESS",
      "status": "NOT_VERIFIED",
      "counts": {
        "NOT_VERIFIED": 2
      }
    }
  },
  "counts": {
    "BLOCKER": 2,
    "CRITICAL": 0,
    "WARNING": 4,
    "INFO": 7,
    "PASS": 24,
    "NOT_VERIFIED": 23,
    "NOT_APPLICABLE": 0
  },
  "coverage": {
    "mode": "gate",
    "artifacts_autodiscovered": [
      "/private/tmp/gprg-example/demo_app/build/app/outputs/bundle/release/app-release.aab",
      "/private/tmp/gprg-example/demo_app/build/app/outputs/flutter-apk/app-release.apk"
    ],
    "network": "não utilizada na auditoria (somente rules --check-sources e API opcional)",
    "project_type": "flutter",
    "gradle_file": "android/app/build.gradle",
    "form_factor": "phone/tablet (nenhum uses-feature de outro formato)",
    "source_files_scanned": 5
  },
  "tools": {
    "java": {
      "available": false,
      "path": null,
      "reason": "desativado (--no-tools)"
    },
    "aapt2": {
      "available": false,
      "path": null,
      "reason": "desativado (--no-tools)"
    },
    "zipalign": {
      "available": false,
      "path": null,
      "reason": "desativado (--no-tools)"
    },
    "apksigner": {
      "available": false,
      "path": null,
      "reason": "desativado (--no-tools)"
    },
    "apkanalyzer": {
      "available": false,
      "path": null,
      "reason": "desativado (--no-tools)"
    },
    "bundletool": {
      "available": false,
      "path": null,
      "reason": "desativado (--no-tools)"
    },
    "llvm-readelf": {
      "available": false,
      "path": null,
      "reason": "desativado (--no-tools)"
    },
    "adb": {
      "available": false,
      "path": null,
      "reason": "desativado (--no-tools)"
    }
  },
  "rules": {
    "count": 67,
    "digest": "18733447bfa8380e7c3c198885d2bb0746af99fde755fa0ab01ddce2225bd2c0",
    "consulted_at": "2026-10-16",
    "sources_status": "fontes não reconsultadas (rode `guardian.py rules --check-sources` antes de auditorias críticas)"
  },
  "inventory": {
    "project": {
      "type": "flutter",
      "agp": "8.7.0",
      "kotlin": null,
      "gradle_wrapper": null,
      "flutter_version": null,
      "dart_version": null,
      "flutter_constraint": ">=3.22.0",
      "dart_constraint": ">=3.3.0 <4.0.0",
      "lock_sdks": {
        "dart": ">=3.5.0 <4.0.0",
        "flutter": ">=3.24.0"
      },
      "target_sdk_expr": "36",
      "target_sdk_resolved_from": null,
      "ndk_version": "28.0.13004108",
      "release_minify": true,
      "product_flavors": [],
      "sensitive_files_present": [
        "android/upload.jks",
        "android/key.properties"
      ]
    },
    "permissions": [
      {
        "permission": "android.permission.INTERNET",
        "rule_id": null,
        "origin_hint": "não determinado (verifique o manifest-merger-report)",
        "declared_in": "manifest mesclado do artefato"
      },
      {
        "permission": "android.permission.ACCESS_BACKGROUND_LOCATION",
        "rule_id": "POL-BACKGROUND-LOCATION",
        "origin_hint": "não determinado (verifique o manifest-merger-report)",
        "declared_in": "manifest mesclado do artefato"
      },
      {
        "permission": "com.android.vending.BILLING",
        "rule_id": null,
        "origin_hint": "Play Billing Library (in_app_purchase)",
        "declared_in": "manifest mesclado do artefato"
      }
    ],
    "native_libs": [
      {
        "name": "base/lib/arm64-v8a/libapp.so",
        "abi": "arm64-v8a",
        "size": 432,
        "compressed": true,
        "elf_class": 64,
        "machine": "aarch64",
        "elf_16kb": true,
        "elf_detail": "PT_LOAD align 0x4000",
        "relro_16kb": true,
        "relro_detail": "sem GNU_RELRO",
        "elf_method": "python-elf"
      },
      {
        "name": "base/lib/armeabi-v7a/libapp.so",
        "abi": "armeabi-v7a",
        "size": 372,
        "compressed": true,
        "elf_class": 32,
        "machine": "arm",
        "elf_16kb": true,
        "elf_detail": "PT_LOAD align 0x4000",
        "relro_16kb": true,
        "relro_detail": "sem GNU_RELRO",
        "elf_method": "python-elf"
      },
      {
        "name": "lib/arm64-v8a/libapp.so",
        "abi": "arm64-v8a",
        "size": 432,
        "compressed": false,
        "elf_class": 64,
        "machine": "aarch64",
        "elf_16kb": true,
        "elf_detail": "PT_LOAD align 0x4000",
        "relro_16kb": true,
        "relro_detail": "sem GNU_RELRO",
        "elf_method": "python-elf",
        "zip_offset": 16384,
        "zip_16kb": true
      }
    ],
    "artifacts": [
      {
        "kind": "aab",
        "path": "/private/tmp/gprg-example/demo_app/build/app/outputs/bundle/release/app-release.aab",
        "sha256": null,
        "modules": [
          "base"
        ],
        "abis": [
          "arm64-v8a",
          "armeabi-v7a"
        ],
        "verification": {
          "manifest": "deterministic (decodificador protobuf aapt2 XmlNode em Python)",
          "bundletool": "NOT_VERIFIED: desativado (--no-tools)"
        },
        "from_cache": false,
        "signature_schemes": [
          "v1/jar"
        ],
        "certificates": [
          {
            "source": "META-INF/KEY.RSA",
            "sha256": "C114816159AF1E22D5F1A275B5AFA56B4F45C1283F0ED042B140AAEDCF840DBA",
            "subject": {
              "CN": "Upload Key"
            },
            "key_algorithm": "RSA",
            "key_bits": 2048
          }
        ],
        "billing_library_version": "7.1.1"
      },
      {
        "kind": "apk",
        "path": "/private/tmp/gprg-example/demo_app/build/app/outputs/flutter-apk/app-release.apk",
        "sha256": null,
        "modules": null,
        "abis": [
          "arm64-v8a"
        ],
        "verification": {
          "manifest": "deterministic (parser AXML em Python)",
          "aapt2": "desativado (--no-tools)"
        },
        "from_cache": false,
        "signature_schemes": [
          "v1/jar"
        ],
        "certificates": [
          {
            "source": "META-INF/CERT.RSA",
            "sha256": "4A4520E2CE4886124F9672AA61BA81AD9846599BB829A3E9A13350C56DB3F550",
            "subject": {
              "CN": "Release Key"
            },
            "key_algorithm": "RSA",
            "key_bits": 2048
          }
        ],
        "billing_library_version": null
      }
    ],
    "dependencies": [
      {
        "name": "flutter",
        "source": "pubspec",
        "version": null,
        "category": null,
        "review_data_types": []
      },
      {
        "name": "firebase_analytics",
        "source": "pubspec",
        "version": "11.3.0",
        "category": "analytics",
        "review_data_types": [
          "App activity",
          "Device or other IDs"
        ]
      },
      {
        "name": "in_app_purchase",
        "source": "pubspec",
        "version": "3.2.0",
        "category": "billing_play",
        "review_data_types": [
          "Purchase history"
        ]
      }
    ],
    "maven_library_count": 0
  },
  "findings": [
    {
      "rule_id": "POL-FOREGROUND-SERVICE",
      "severity": "BLOCKER",
      "section": "permissions",
      "title": "Tipo de foreground service sem a permissão correspondente",
      "component": "app-release.aab",